{
  "$schema": "./blackboard.schema.json",
  "version": "1.0.0",
  "meta": {
    "title": "SimpleLLMs Blackboard",
    "description": "Agent corrections and learned limitations",
    "lastUpdated": "2026-01-11T00:00:00Z",
    "totalEntries": 7
  },
  "entries": [
    {
      "id": "bb-001",
      "timestamp": "2026-01-11T00:00:00Z",
      "lastSeen": "2026-01-11T00:00:00Z",
      "agent": "universal",
      "violation": "I WILL NOT HALLUCINATE FILE PATHS",
      "context": "Agent invented a file path that didn't exist instead of checking first",
      "trigger": "File not found error after confident assertion",
      "repetitions": 100,
      "severity": "critical",
      "category": "hallucination"
    },
    {
      "id": "bb-002",
      "timestamp": "2026-01-11T00:00:00Z",
      "lastSeen": "2026-01-11T00:00:00Z",
      "agent": "universal",
      "violation": "I WILL NOT ECHO SECRETS TO TERMINAL",
      "context": "Attempted to run 'echo $API_KEY' exposing credentials",
      "trigger": "Varlock skill intercept",
      "repetitions": 50,
      "severity": "critical",
      "category": "security"
    },
    {
      "id": "bb-003",
      "timestamp": "2026-01-11T00:00:00Z",
      "lastSeen": "2026-01-11T00:00:00Z",
      "agent": "ralph",
      "violation": "I WILL NOT LOOP FOREVER ON IMPOSSIBLE TASKS",
      "context": "Retried same failed approach 30+ times without pivoting",
      "trigger": "Max iterations reached with identical errors",
      "repetitions": 30,
      "severity": "high",
      "category": "efficiency"
    },
    {
      "id": "bb-004",
      "timestamp": "2026-01-11T00:00:00Z",
      "lastSeen": "2026-01-11T00:00:00Z",
      "agent": "bart",
      "violation": "I WILL NOT BREAK PRODUCTION IN THE NAME OF CREATIVITY",
      "context": "Disabled security to 'make things work'",
      "trigger": "Attempted chmod 777 or security bypass",
      "repetitions": 25,
      "severity": "critical",
      "category": "security"
    },
    {
      "id": "bb-005",
      "timestamp": "2026-01-11T00:00:00Z",
      "lastSeen": "2026-01-11T00:00:00Z",
      "agent": "lisa",
      "violation": "I WILL NOT RESEARCH FOREVER WITHOUT SHIPPING",
      "context": "Spent excessive time reading before writing any code",
      "trigger": "Research phase exceeded time limit",
      "repetitions": 20,
      "severity": "medium",
      "category": "efficiency"
    },
    {
      "id": "bb-006",
      "timestamp": "2026-01-11T00:00:00Z",
      "lastSeen": "2026-01-11T00:00:00Z",
      "agent": "marge",
      "violation": "I WILL NOT REORGANIZE WORKING CODE JUST BECAUSE IT'S UGLY",
      "context": "Refactored stable code that wasn't blocking progress",
      "trigger": "Scope creep during integration task",
      "repetitions": 15,
      "severity": "medium",
      "category": "scope"
    },
    {
      "id": "bb-007",
      "timestamp": "2026-01-11T00:00:00Z",
      "lastSeen": "2026-01-11T00:00:00Z",
      "agent": "homer",
      "violation": "I WILL NOT SACRIFICE CORRECTNESS FOR SPEED",
      "context": "Bulk processed files without verification step",
      "trigger": "Batch operation corrupted files",
      "repetitions": 10,
      "severity": "high",
      "category": "quality"
    }
  ],
  "categories": {
    "hallucination": {
      "color": "#FF6B6B",
      "icon": "brain",
      "description": "Making up information that doesn't exist"
    },
    "security": {
      "color": "#EE4444",
      "icon": "shield",
      "description": "Security violations and credential exposure"
    },
    "efficiency": {
      "color": "#FFB347",
      "icon": "clock",
      "description": "Wasted tokens or time on unproductive work"
    },
    "scope": {
      "color": "#87CEEB",
      "icon": "expand",
      "description": "Going beyond the requested task"
    },
    "quality": {
      "color": "#9B59B6",
      "icon": "star",
      "description": "Code quality and correctness issues"
    }
  },
  "agents": {
    "universal": {
      "displayName": "All Agents",
      "color": "#4ECDC4",
      "avatar": "cloud"
    },
    "ralph": {
      "displayName": "R.A.L.P.H.",
      "color": "#F39C12",
      "avatar": "ralph"
    },
    "bart": {
      "displayName": "B.A.R.T.",
      "color": "#E74C3C",
      "avatar": "bart"
    },
    "lisa": {
      "displayName": "L.I.S.A.",
      "color": "#9B59B6",
      "avatar": "lisa"
    },
    "marge": {
      "displayName": "M.A.R.G.E.",
      "color": "#3498DB",
      "avatar": "marge"
    },
    "homer": {
      "displayName": "H.O.M.E.R.",
      "color": "#1ABC9C",
      "avatar": "homer"
    }
  },
  "triggerPhrases": [
    "never do",
    "I told you not to",
    "don't do that",
    "should not",
    "must not",
    "WILL NOT",
    "stop doing",
    "please don't",
    "that's wrong",
    "incorrect approach"
  ]
}
